{
  "$schema": "https://json-schema.org/draft/2020-12/schema",
  "$id": "dataset.schema.json",
  "title": "Dataset Metadata",
  "description": "Study-level metadata for a neuroimaging dataset. Contains what modalities are present, participant demographics (from participants.tsv), signal properties shared across recordings, event/HED annotation status, and provenance. Aligned with BIDS dataset_description.json and participants.tsv. Platform-neutral; platform-specific fields belong in extensions.",
  "type": "object",
  "required": ["dataset_id", "name", "source", "recording_modality"],
  "properties": {
    "schema_version": {
      "type": "string",
      "description": "Envelope field: schema version (present when validated through root schema)."
    },
    "doc_type": {
      "type": "string",
      "description": "Envelope field: document type (present when validated through root schema)."
    },
    "dataset_id": {
      "type": "string",
      "description": "Unique dataset identifier (e.g., 'ds003645' for OpenNeuro, 'nm000108' for NEMAR).",
      "pattern": "^[a-z]{2}[0-9]+$"
    },
    "name": {
      "type": "string",
      "description": "Human-readable title of the dataset."
    },
    "description": {
      "type": ["string", "null"],
      "description": "Short abstract or description of the dataset."
    },
    "source": {
      "type": "string",
      "description": "Origin of the dataset (e.g., 'openneuro', 'nemar', 'gin').",
      "enum": ["openneuro", "nemar", "gin", "other"]
    },
    "recording_modality": {
      "type": "array",
      "description": "Recording modalities present in the dataset (e.g., ['EEG', 'MEG', 'MRI']). Dataset-level property; individual data files inherit their modality from the BIDS datatype directory.",
      "items": { "type": "string" },
      "minItems": 1
    },
    "bids_version": {
      "type": ["string", "null"],
      "description": "BIDS specification version the dataset follows."
    },
    "license": {
      "type": ["string", "null"],
      "description": "Dataset license (e.g., 'CC0', 'CC-BY-4.0')."
    },
    "authors": {
      "type": "array",
      "description": "List of dataset authors as structured person objects.",
      "items": { "$ref": "../definitions/person.schema.json" }
    },
    "funding": {
      "type": "array",
      "description": "Funding sources with structured grant information.",
      "items": {
        "type": "object",
        "required": ["funder_name"],
        "properties": {
          "funder_name": {
            "type": "string",
            "description": "Name of the funding organization."
          },
          "award_number": {
            "type": ["string", "null"],
            "description": "Grant or award number."
          },
          "award_title": {
            "type": ["string", "null"],
            "description": "Title of the funded project."
          },
          "funder_identifier": {
            "type": ["string", "null"],
            "description": "Persistent identifier for the funder (e.g., Crossref Funder ID, ROR ID)."
          },
          "funder_identifier_type": {
            "type": ["string", "null"],
            "description": "Type of funder identifier.",
            "enum": ["Crossref Funder ID", "GRID", "ISNI", "ROR", "Other", null]
          },
          "award_uri": {
            "type": ["string", "null"],
            "description": "URI to the award or grant information page.",
            "format": "uri"
          }
        },
        "additionalProperties": false
      }
    },
    "readme": {
      "type": ["string", "null"],
      "description": "Content of the dataset README."
    },
    "tasks": {
      "type": "array",
      "description": "Experimental tasks present in the dataset.",
      "items": { "type": "string" }
    },
    "datatypes": {
      "type": ["array", "null"],
      "description": "BIDS datatype directories present in the dataset (e.g., ['eeg', 'anat']).",
      "items": { "type": "string" }
    },
    "sessions": {
      "type": ["array", "null"],
      "description": "Session labels present in the dataset (e.g., ['pre', 'post']).",
      "items": { "type": "string" }
    },
    "sessions_count": {
      "type": ["integer", "null"],
      "description": "Number of sessions in the dataset.",
      "minimum": 0
    },
    "has_hed_annotations": {
      "type": ["boolean", "null"],
      "description": "Whether the dataset includes Hierarchical Event Descriptors (HED) annotations."
    },
    "hed_version": {
      "type": ["string", "null"],
      "description": "Version of the HED schema used for annotations (e.g., '8.1.0')."
    },
    "has_event_annotations": {
      "type": ["boolean", "null"],
      "description": "Whether the dataset includes event/stimulus annotations (events.tsv files)."
    },
    "demographics": {
      "$ref": "../definitions/demographics.schema.json"
    },
    "data_summary": {
      "$ref": "../definitions/dataSummary.schema.json"
    },
    "signal_defaults": {
      "$ref": "../definitions/inheritable.schema.json"
    },
    "provenance": {
      "$ref": "../definitions/provenance.schema.json"
    },
    "keywords": {
      "type": "array",
      "description": "Subject terms and keywords for findability. Supports both plain keywords (term only) and controlled vocabulary entries (with scheme and URI). Aligns with DataCite Subject (property 6).",
      "items": { "$ref": "../definitions/subject.schema.json" }
    },
    "related_identifiers": {
      "type": "array",
      "description": "Related resources: associated papers, source datasets, code repositories, prior versions. These links feed into scholarly knowledge graphs and citation indices. Aligns with DataCite RelatedIdentifier (property 12).",
      "items": { "$ref": "../definitions/relatedIdentifier.schema.json" }
    },
    "contributors": {
      "type": "array",
      "description": "Contributors with typed roles beyond the primary authors. Includes data collectors, hosting institutions, project leaders, etc. Aligns with DataCite Contributor (property 7).",
      "items": { "$ref": "../definitions/contributor.schema.json" }
    },
    "dates": {
      "type": "array",
      "description": "Semantically typed dates: data collection period, creation date, publication date, etc. Aligns with DataCite Date (property 8).",
      "items": { "$ref": "../definitions/structuredDate.schema.json" }
    },
    "rights": {
      "type": "array",
      "description": "Structured license/rights entries with URIs and machine-readable identifiers. Complements the simpler 'license' string field. Aligns with DataCite Rights (property 16).",
      "items": { "$ref": "../definitions/rights.schema.json" }
    },
    "language": {
      "type": ["string", "null"],
      "description": "Primary language of the dataset content (IETF BCP 47 tag, e.g., 'en'). Aligns with DataCite Language (property 9)."
    },
    "external_links": {
      "$ref": "../definitions/externalLinks.schema.json"
    },
    "extensions": {
      "$ref": "../extensions/extensionsContainer.schema.json"
    }
  },
  "additionalProperties": false
}
